{
  "images": {
    "1": "atlas@1x.png",
    "2": "atlas@2x.png",
    "0.5": "atlas@0.5x.png"
  },
  "tileW": 64,
  "tileH": 32,
  "meta": {
    "source": "OpenGFX (https://github.com/OpenTTD/OpenGFX), GPLv2; PP-12 standalone TTD-style buildings (src/assets/sprites/png/*/ttd/)",
    "generatedBy": "tools/slice-atlas.mjs",
    "note": "coordinates and anchors are at 1x; multiply by zoom for @2x/@0.5x"
  },
  "sprites": {
    "terrain_grass": {
      "x": 4,
      "y": 4,
      "h": 32,
      "footprint": [
        1,
        1
      ],
      "anchor": [
        32,
        31
      ],
      "w": 64
    },
    "terrain_rough": {
      "x": 72,
      "y": 4,
      "h": 32,
      "footprint": [
        1,
        1
      ],
      "anchor": [
        32,
        31
      ],
      "w": 64
    },
    "terrain_water": {
      "x": 140,
      "y": 4,
      "h": 32,
      "footprint": [
        1,
        1
      ],
      "anchor": [
        32,
        31
      ],
      "w": 64
    },
    "ore_mine_t0": {
      "x": 208,
      "y": 4,
      "h": 65,
      "footprint": [
        1,
        1
      ],
      "anchor": [
        32,
        64
      ],
      "w": 73
    },
    "ore_mine_t2": {
      "x": 285,
      "y": 4,
      "h": 50,
      "footprint": [
        1,
        1
      ],
      "anchor": [
        32,
        49
      ],
      "w": 64
    },
    "ore_mine_t3": {
      "x": 353,
      "y": 4,
      "h": 57,
      "footprint": [
        1,
        1
      ],
      "anchor": [
        32,
        56
      ],
      "w": 64
    },
    "ore_mine_t5": {
      "x": 421,
      "y": 4,
      "h": 32,
      "footprint": [
        1,
        1
      ],
      "anchor": [
        32,
        31
      ],
      "w": 64
    },
    "ore_mine_t6": {
      "x": 489,
      "y": 4,
      "h": 32,
      "footprint": [
        1,
        1
      ],
      "anchor": [
        32,
        31
      ],
      "w": 64
    },
    "farm_t33": {
      "x": 557,
      "y": 4,
      "h": 64,
      "footprint": [
        1,
        1
      ],
      "anchor": [
        32,
        59
      ],
      "w": 64
    },
    "farm_t34": {
      "x": 625,
      "y": 4,
      "h": 49,
      "footprint": [
        1,
        1
      ],
      "anchor": [
        32,
        48
      ],
      "w": 64
    },
    "farm_t35": {
      "x": 693,
      "y": 4,
      "h": 37,
      "footprint": [
        1,
        1
      ],
      "anchor": [
        32,
        36
      ],
      "w": 64
    },
    "farm_t36": {
      "x": 761,
      "y": 4,
      "h": 44,
      "footprint": [
        1,
        1
      ],
      "anchor": [
        32,
        43
      ],
      "w": 64
    },
    "farm_t37": {
      "x": 829,
      "y": 4,
      "h": 66,
      "footprint": [
        1,
        1
      ],
      "anchor": [
        32,
        65
      ],
      "w": 70
    },
    "farm_t38": {
      "x": 903,
      "y": 4,
      "h": 33,
      "footprint": [
        1,
        1
      ],
      "anchor": [
        32,
        32
      ],
      "w": 64
    },
    "forest_t16": {
      "x": 4,
      "y": 264,
      "h": 71,
      "footprint": [
        1,
        1
      ],
      "anchor": [
        32,
        70
      ],
      "w": 64
    },
    "oil_rig_t29": {
      "x": 72,
      "y": 264,
      "h": 61,
      "footprint": [
        1,
        1
      ],
      "anchor": [
        32,
        60
      ],
      "w": 384,
      "frames": 6,
      "frameMs": 180
    },
    "gold_mine_t72": {
      "x": 460,
      "y": 264,
      "h": 52,
      "footprint": [
        1,
        1
      ],
      "anchor": [
        32,
        52
      ],
      "w": 64
    },
    "gold_mine_t73": {
      "x": 528,
      "y": 264,
      "h": 32,
      "footprint": [
        1,
        1
      ],
      "anchor": [
        32,
        32
      ],
      "w": 64
    },
    "gold_mine_t74": {
      "x": 596,
      "y": 264,
      "h": 32,
      "footprint": [
        1,
        1
      ],
      "anchor": [
        32,
        32
      ],
      "w": 64
    },
    "gold_mine_t75": {
      "x": 664,
      "y": 264,
      "h": 43,
      "footprint": [
        1,
        1
      ],
      "anchor": [
        32,
        43
      ],
      "w": 64
    },
    "gold_mine_t76": {
      "x": 732,
      "y": 264,
      "h": 32,
      "footprint": [
        1,
        1
      ],
      "anchor": [
        32,
        31
      ],
      "w": 64
    },
    "gold_mine_t77": {
      "x": 800,
      "y": 264,
      "h": 32,
      "footprint": [
        1,
        1
      ],
      "anchor": [
        32,
        31
      ],
      "w": 64
    },
    "gold_mine_t78": {
      "x": 868,
      "y": 264,
      "h": 32,
      "footprint": [
        1,
        1
      ],
      "anchor": [
        32,
        31
      ],
      "w": 64
    },
    "gold_mine_t79": {
      "x": 4,
      "y": 339,
      "h": 59,
      "footprint": [
        1,
        1
      ],
      "anchor": [
        32,
        58
      ],
      "w": 192,
      "frames": 3,
      "frameMs": 200
    },
    "gold_mine_t80": {
      "x": 200,
      "y": 339,
      "h": 32,
      "footprint": [
        1,
        1
      ],
      "anchor": [
        32,
        31
      ],
      "w": 64
    },
    "gold_mine_t81": {
      "x": 268,
      "y": 339,
      "h": 32,
      "footprint": [
        1,
        1
      ],
      "anchor": [
        32,
        31
      ],
      "w": 64
    },
    "gold_mine_t82": {
      "x": 336,
      "y": 339,
      "h": 32,
      "footprint": [
        1,
        1
      ],
      "anchor": [
        32,
        31
      ],
      "w": 64
    },
    "gold_mine_t83": {
      "x": 404,
      "y": 339,
      "h": 32,
      "footprint": [
        1,
        1
      ],
      "anchor": [
        32,
        31
      ],
      "w": 64
    },
    "gold_mine_t84": {
      "x": 472,
      "y": 339,
      "h": 32,
      "footprint": [
        1,
        1
      ],
      "anchor": [
        32,
        31
      ],
      "w": 64
    },
    "gold_mine_t85": {
      "x": 540,
      "y": 339,
      "h": 32,
      "footprint": [
        1,
        1
      ],
      "anchor": [
        32,
        31
      ],
      "w": 64
    },
    "gold_mine_t86": {
      "x": 608,
      "y": 339,
      "h": 32,
      "footprint": [
        1,
        1
      ],
      "anchor": [
        32,
        31
      ],
      "w": 64
    },
    "gold_mine_t87": {
      "x": 676,
      "y": 339,
      "h": 32,
      "footprint": [
        1,
        1
      ],
      "anchor": [
        32,
        31
      ],
      "w": 64
    },
    "quarry_t72": {
      "x": 744,
      "y": 339,
      "h": 52,
      "footprint": [
        1,
        1
      ],
      "anchor": [
        32,
        52
      ],
      "w": 64
    },
    "quarry_t73": {
      "x": 812,
      "y": 339,
      "h": 32,
      "footprint": [
        1,
        1
      ],
      "anchor": [
        32,
        32
      ],
      "w": 64
    },
    "quarry_t74": {
      "x": 880,
      "y": 339,
      "h": 32,
      "footprint": [
        1,
        1
      ],
      "anchor": [
        32,
        32
      ],
      "w": 64
    },
    "quarry_t75": {
      "x": 948,
      "y": 339,
      "h": 43,
      "footprint": [
        1,
        1
      ],
      "anchor": [
        32,
        43
      ],
      "w": 64
    },
    "quarry_t76": {
      "x": 4,
      "y": 402,
      "h": 32,
      "footprint": [
        1,
        1
      ],
      "anchor": [
        32,
        31
      ],
      "w": 64
    },
    "quarry_t77": {
      "x": 72,
      "y": 402,
      "h": 32,
      "footprint": [
        1,
        1
      ],
      "anchor": [
        32,
        31
      ],
      "w": 64
    },
    "quarry_t78": {
      "x": 140,
      "y": 402,
      "h": 32,
      "footprint": [
        1,
        1
      ],
      "anchor": [
        32,
        31
      ],
      "w": 64
    },
    "quarry_t79": {
      "x": 208,
      "y": 402,
      "h": 59,
      "footprint": [
        1,
        1
      ],
      "anchor": [
        32,
        58
      ],
      "w": 192,
      "frames": 3,
      "frameMs": 200
    },
    "quarry_t80": {
      "x": 404,
      "y": 402,
      "h": 32,
      "footprint": [
        1,
        1
      ],
      "anchor": [
        32,
        31
      ],
      "w": 64
    },
    "quarry_t81": {
      "x": 472,
      "y": 402,
      "h": 32,
      "footprint": [
        1,
        1
      ],
      "anchor": [
        32,
        31
      ],
      "w": 64
    },
    "quarry_t82": {
      "x": 540,
      "y": 402,
      "h": 32,
      "footprint": [
        1,
        1
      ],
      "anchor": [
        32,
        31
      ],
      "w": 64
    },
    "quarry_t83": {
      "x": 608,
      "y": 402,
      "h": 32,
      "footprint": [
        1,
        1
      ],
      "anchor": [
        32,
        31
      ],
      "w": 64
    },
    "quarry_t84": {
      "x": 676,
      "y": 402,
      "h": 32,
      "footprint": [
        1,
        1
      ],
      "anchor": [
        32,
        31
      ],
      "w": 64
    },
    "quarry_t85": {
      "x": 744,
      "y": 402,
      "h": 32,
      "footprint": [
        1,
        1
      ],
      "anchor": [
        32,
        31
      ],
      "w": 64
    },
    "quarry_t86": {
      "x": 812,
      "y": 402,
      "h": 32,
      "footprint": [
        1,
        1
      ],
      "anchor": [
        32,
        31
      ],
      "w": 64
    },
    "quarry_t87": {
      "x": 880,
      "y": 402,
      "h": 32,
      "footprint": [
        1,
        1
      ],
      "anchor": [
        32,
        31
      ],
      "w": 64
    },
    "factory_blue": {
      "x": 948,
      "y": 402,
      "h": 78,
      "footprint": [
        1,
        1
      ],
      "anchor": [
        32,
        77
      ],
      "w": 64
    },
    "factory_red": {
      "x": 4,
      "y": 484,
      "h": 78,
      "footprint": [
        1,
        1
      ],
      "anchor": [
        32,
        77
      ],